{
  "schemaVersion": 1,
  "version": "clause_branch_register_v1",
  "requirementsSource": {
    "path": "docs/requirements/requirements-pitchlog-2026-07-22.md",
    "version": "2.10",
    "status": "approved"
  },
  "authorSignature": {
    "authorId": "codex",
    "recordedOn": "2026-09-28",
    "statement": "enumerated-directly-from-approved-requirements"
  },
  "branchCount": 69,
  "gameEndOutcomeBranches": {
    "normalEnd": "GAME-END-NORMAL",
    "extraInningContinue": "GAME-END-EXTRA-CONTINUE",
    "limitDraw": "GAME-END-LIMIT-DRAW",
    "tiebreakContinue": "GAME-END-TIEBREAK-CONTINUE",
    "walkOff": "GAME-END-WALK-OFF"
  },
  "branches": [
    {
      "branchId": "COLD-01",
      "branchKind": "requirement-branch-row",
      "coverageKind": "normative-case",
      "sourceClauseIds": [
        "req:F-1"
      ],
      "relatedClauseBranchIds": [],
      "gapIds": [
        "GAP-03"
      ]
    },
    {
      "branchId": "COLD-02",
      "branchKind": "requirement-branch-row",
      "coverageKind": "normative-case",
      "sourceClauseIds": [
        "req:F-1"
      ],
      "relatedClauseBranchIds": [],
      "gapIds": [
        "GAP-03"
      ]
    },
    {
      "branchId": "COLD-03",
      "branchKind": "requirement-branch-row",
      "coverageKind": "normative-case",
      "sourceClauseIds": [
        "req:F-1"
      ],
      "relatedClauseBranchIds": [],
      "gapIds": [
        "GAP-03"
      ]
    },
    {
      "branchId": "COLD-04",
      "branchKind": "requirement-branch-row",
      "coverageKind": "normative-case",
      "sourceClauseIds": [
        "req:F-1"
      ],
      "relatedClauseBranchIds": [],
      "gapIds": [
        "GAP-03"
      ]
    },
    {
      "branchId": "COLD-05",
      "branchKind": "requirement-branch-row",
      "coverageKind": "normative-case",
      "sourceClauseIds": [
        "req:F-1"
      ],
      "relatedClauseBranchIds": [],
      "gapIds": [
        "GAP-03"
      ]
    },
    {
      "branchId": "COLD-06",
      "branchKind": "requirement-branch-row",
      "coverageKind": "normative-case",
      "sourceClauseIds": [
        "req:F-1"
      ],
      "relatedClauseBranchIds": [],
      "gapIds": [
        "GAP-03"
      ]
    },
    {
      "branchId": "COLD-07",
      "branchKind": "requirement-branch-row",
      "coverageKind": "normative-case",
      "sourceClauseIds": [
        "req:F-1"
      ],
      "relatedClauseBranchIds": [],
      "gapIds": [
        "GAP-03"
      ]
    },
    {
      "branchId": "COLD-08",
      "branchKind": "requirement-branch-row",
      "coverageKind": "normative-case",
      "sourceClauseIds": [
        "req:F-1"
      ],
      "relatedClauseBranchIds": [],
      "gapIds": [
        "GAP-03"
      ]
    },
    {
      "branchId": "COLD-09",
      "branchKind": "requirement-branch-row",
      "coverageKind": "normative-case",
      "sourceClauseIds": [
        "req:F-1"
      ],
      "relatedClauseBranchIds": [],
      "gapIds": [
        "GAP-03"
      ]
    },
    {
      "branchId": "DRAW-01",
      "branchKind": "requirement-branch-row",
      "coverageKind": "normative-case",
      "sourceClauseIds": [
        "req:F-1"
      ],
      "relatedClauseBranchIds": [],
      "gapIds": [
        "GAP-04"
      ]
    },
    {
      "branchId": "DRAW-02",
      "branchKind": "requirement-branch-row",
      "coverageKind": "normative-case",
      "sourceClauseIds": [
        "req:F-1"
      ],
      "relatedClauseBranchIds": [],
      "gapIds": [
        "GAP-04"
      ]
    },
    {
      "branchId": "DRAW-03",
      "branchKind": "requirement-branch-row",
      "coverageKind": "normative-case",
      "sourceClauseIds": [
        "req:F-1"
      ],
      "relatedClauseBranchIds": [],
      "gapIds": [
        "GAP-04"
      ]
    },
    {
      "branchId": "DRAW-04",
      "branchKind": "requirement-branch-row",
      "coverageKind": "normative-case",
      "sourceClauseIds": [
        "req:F-1"
      ],
      "relatedClauseBranchIds": [],
      "gapIds": [
        "GAP-04"
      ]
    },
    {
      "branchId": "DRAW-05",
      "branchKind": "requirement-branch-row",
      "coverageKind": "normative-case",
      "sourceClauseIds": [
        "req:F-1"
      ],
      "relatedClauseBranchIds": [],
      "gapIds": [
        "GAP-04"
      ]
    },
    {
      "branchId": "DRAW-06",
      "branchKind": "requirement-branch-row",
      "coverageKind": "normative-case",
      "sourceClauseIds": [
        "req:F-1"
      ],
      "relatedClauseBranchIds": [],
      "gapIds": [
        "GAP-04"
      ]
    },
    {
      "branchId": "DRAW-07",
      "branchKind": "requirement-branch-row",
      "coverageKind": "normative-case",
      "sourceClauseIds": [
        "req:F-1"
      ],
      "relatedClauseBranchIds": [],
      "gapIds": [
        "GAP-04"
      ]
    },
    {
      "branchId": "DRAW-08",
      "branchKind": "requirement-branch-row",
      "coverageKind": "normative-case",
      "sourceClauseIds": [
        "req:F-1"
      ],
      "relatedClauseBranchIds": [],
      "gapIds": [
        "GAP-04"
      ]
    },
    {
      "branchId": "DRAW-09",
      "branchKind": "requirement-branch-row",
      "coverageKind": "normative-case",
      "sourceClauseIds": [
        "req:F-1"
      ],
      "relatedClauseBranchIds": [],
      "gapIds": [
        "GAP-04"
      ]
    },
    {
      "branchId": "DRAW-10",
      "branchKind": "requirement-branch-row",
      "coverageKind": "normative-case",
      "sourceClauseIds": [
        "req:F-1"
      ],
      "relatedClauseBranchIds": [],
      "gapIds": [
        "GAP-04"
      ]
    },
    {
      "branchId": "XMARK-01",
      "branchKind": "requirement-branch-row",
      "coverageKind": "normative-case",
      "sourceClauseIds": [
        "req:FR-020"
      ],
      "relatedClauseBranchIds": [],
      "gapIds": [
        "GAP-01",
        "GAP-05"
      ]
    },
    {
      "branchId": "XMARK-02",
      "branchKind": "requirement-branch-row",
      "coverageKind": "normative-case",
      "sourceClauseIds": [
        "req:FR-005",
        "req:FR-020"
      ],
      "relatedClauseBranchIds": [],
      "gapIds": [
        "GAP-05"
      ]
    },
    {
      "branchId": "XMARK-03",
      "branchKind": "requirement-branch-row",
      "coverageKind": "normative-case",
      "sourceClauseIds": [
        "req:FR-020"
      ],
      "relatedClauseBranchIds": [],
      "gapIds": [
        "GAP-05"
      ]
    },
    {
      "branchId": "OUT3-01",
      "branchKind": "requirement-branch-row",
      "coverageKind": "normative-case",
      "sourceClauseIds": [
        "req:A-1"
      ],
      "relatedClauseBranchIds": [],
      "gapIds": [
        "GAP-06"
      ]
    },
    {
      "branchId": "OUT3-02",
      "branchKind": "requirement-branch-row",
      "coverageKind": "normative-case",
      "sourceClauseIds": [
        "req:A-1"
      ],
      "relatedClauseBranchIds": [],
      "gapIds": [
        "GAP-06"
      ]
    },
    {
      "branchId": "OUT3-03",
      "branchKind": "requirement-branch-row",
      "coverageKind": "normative-case",
      "sourceClauseIds": [
        "req:A-1"
      ],
      "relatedClauseBranchIds": [],
      "gapIds": [
        "GAP-06"
      ]
    },
    {
      "branchId": "OUT3-04",
      "branchKind": "requirement-branch-row",
      "coverageKind": "normative-case",
      "sourceClauseIds": [
        "req:A-1",
        "req:FR-003",
        "req:OUT3-04",
        "req:OUT3-05",
        "req:RBI-03",
        "req:RBI-04",
        "req:RBI-08",
        "req:E-1",
        "req:E-2"
      ],
      "relatedClauseBranchIds": [],
      "gapIds": [
        "GAP-06"
      ]
    },
    {
      "branchId": "OUT3-05",
      "branchKind": "requirement-branch-row",
      "coverageKind": "normative-case",
      "sourceClauseIds": [
        "req:A-1",
        "req:FR-003",
        "req:OUT3-04",
        "req:OUT3-05",
        "req:RBI-03",
        "req:RBI-04",
        "req:RBI-08",
        "req:E-1",
        "req:E-2"
      ],
      "relatedClauseBranchIds": [],
      "gapIds": [
        "GAP-06"
      ]
    },
    {
      "branchId": "ADV-01",
      "branchKind": "requirement-branch-row",
      "coverageKind": "normative-case",
      "sourceClauseIds": [
        "req:E-1"
      ],
      "relatedClauseBranchIds": [],
      "gapIds": [
        "GAP-07"
      ]
    },
    {
      "branchId": "ADV-02",
      "branchKind": "requirement-branch-row",
      "coverageKind": "normative-case",
      "sourceClauseIds": [
        "req:E-1"
      ],
      "relatedClauseBranchIds": [],
      "gapIds": [
        "GAP-07"
      ]
    },
    {
      "branchId": "ADV-03",
      "branchKind": "requirement-branch-row",
      "coverageKind": "normative-case",
      "sourceClauseIds": [
        "req:E-1"
      ],
      "relatedClauseBranchIds": [],
      "gapIds": [
        "GAP-07"
      ]
    },
    {
      "branchId": "ADV-04",
      "branchKind": "requirement-branch-row",
      "coverageKind": "normative-case",
      "sourceClauseIds": [
        "req:E-1"
      ],
      "relatedClauseBranchIds": [],
      "gapIds": [
        "GAP-07"
      ]
    },
    {
      "branchId": "INT-01",
      "branchKind": "requirement-branch-row",
      "coverageKind": "normative-case",
      "sourceClauseIds": [
        "req:E-1"
      ],
      "relatedClauseBranchIds": [],
      "gapIds": [
        "GAP-07"
      ]
    },
    {
      "branchId": "INT-02",
      "branchKind": "requirement-branch-row",
      "coverageKind": "normative-case",
      "sourceClauseIds": [
        "req:E-1"
      ],
      "relatedClauseBranchIds": [],
      "gapIds": [
        "GAP-07"
      ]
    },
    {
      "branchId": "INT-03",
      "branchKind": "requirement-branch-row",
      "coverageKind": "normative-case",
      "sourceClauseIds": [
        "req:E-1"
      ],
      "relatedClauseBranchIds": [],
      "gapIds": [
        "GAP-07"
      ]
    },
    {
      "branchId": "INT-04",
      "branchKind": "requirement-branch-row",